{
  "assurance": "head_enforced",
  "candidate_id": "cnd_44444444444444444444444444444444",
  "capability_binding_id": "cpb_cccccccccccccccccccccccccccccccc",
  "evidence_snapshot_sha256": "aaaaaaaaaaaaaaaaaaaaaaaaaaaaaaaaaaaaaaaaaaaaaaaaaaaaaaaaaaaaaaaa",
  "expected_base_revision": "7777777777777777777777777777777777777777",
  "fold_id": "ifd_55555555555555555555555555555555",
  "head_revision": "8888888888888888888888888888888888888888",
  "integration_ref": "refs/heads/main",
  "object_format": "sha1",
  "policy_id": "gpl_22222222222222222222222222222222",
  "policy_revision": "3333333333333333333333333333333333333333333333333333333333333333",
  "queue_item_id": "iqm_11111111111111111111111111111111",
  "queue_version": 4,
  "repository_identity": "boxp_66666666666666666666666666666666",
  "schema_version": 1,
  "service_operation_id": "sop_bbbbbbbbbbbbbbbbbbbbbbbbbbbbbbbb",
  "service_operation_sha256": "dddddddddddddddddddddddddddddddddddddddddddddddddddddddddddddddd",
  "tree_revision": "9999999999999999999999999999999999999999"
}
